{
  "note_id": "047eb5d6-8366-4fb8-8992-97daa4f12a0d",
  "entities": [
    {
      "id": "e1",
      "label": "Mock Entity 1",
      "type": "Concept"
    },
    {
      "id": "e2",
      "label": "Mock Entity 2",
      "type": "Concept"
    }
  ],
  "relations": [
    "related_to"
  ],
  "triples": [
    {
      "subject": "e1",
      "predicate": "related_to",
      "object": "e2"
    }
  ]
}