{
  "note_id": "d3c28877-0d45-43f7-bd3b-c23be3e97ad2",
  "entities": [
    {
      "id": "e1",
      "label": "Mock Entity 1",
      "type": "Concept"
    },
    {
      "id": "e2",
      "label": "Mock Entity 2",
      "type": "Concept"
    }
  ],
  "relations": [
    "related_to"
  ],
  "triples": [
    {
      "subject": "e1",
      "predicate": "related_to",
      "object": "e2"
    }
  ]
}