{
  "note_id": "d7d4e0d0-4d80-4437-bcb4-b03406a03d93",
  "entities": [
    {
      "id": "e1",
      "label": "Mock Entity 1",
      "type": "Concept"
    },
    {
      "id": "e2",
      "label": "Mock Entity 2",
      "type": "Concept"
    }
  ],
  "relations": [
    "related_to"
  ],
  "triples": [
    {
      "subject": "e1",
      "predicate": "related_to",
      "object": "e2"
    }
  ]
}