{
  "note_id": "0cf5e57d-443a-4690-ae6b-d20f09445324",
  "entities": [
    {
      "id": "e1",
      "label": "Mock Entity 1",
      "type": "Concept"
    },
    {
      "id": "e2",
      "label": "Mock Entity 2",
      "type": "Concept"
    }
  ],
  "relations": [
    "related_to"
  ],
  "triples": [
    {
      "subject": "e1",
      "predicate": "related_to",
      "object": "e2"
    }
  ]
}