{
  "note_id": "e0f5eb5e-ac77-4809-b260-03cbaad828a2",
  "entities": [
    {
      "id": "e1",
      "label": "Mock Entity 1",
      "type": "Concept"
    },
    {
      "id": "e2",
      "label": "Mock Entity 2",
      "type": "Concept"
    }
  ],
  "relations": [
    "related_to"
  ],
  "triples": [
    {
      "subject": "e1",
      "predicate": "related_to",
      "object": "e2"
    }
  ]
}